,post_id,title,category,score,num_comments,author,collected_at,engagement,is_popular
177,47619322,A $20/month user costs OpenAI $65 in compute. AI video is a money furnace,technology,76,42,Aedelon,2026-04-05 15:53:17.608699,0.5454545454545454,False
178,47620426,Amazon data center in Bahrain attacked by Iranian Revolutionary Guards,technology,25,5,topherPedersen,2026-04-05 15:53:20.065640,0.19230769230769232,False
179,47607211,Wikidata: WikiProject Ontology/Ontology Course,technology,10,2,taubek,2026-04-05 15:53:22.723864,0.18181818181818182,False
180,47592392,Show HN: EU Leadership – Live API data site comparing Europe to the world,technology,34,16,aureljohn,2026-04-05 15:53:27.946023,0.45714285714285713,False
181,47615058,Old code never dies: why legacy software is often safer than new code,technology,6,0,speckx,2026-04-05 15:53:30.475651,0.0,False
182,47609883,"Salomi, a research repo on extreme low-bit transformer quantization",science,12,4,Edward9055,2026-04-05 15:53:34.180147,0.3076923076923077,False
183,47633226,Meta Pauses Work with Mercor After Data Breach Puts AI Industry Secrets at Risk,technology,11,1,srameshc,2026-04-05 15:53:39.654242,0.08333333333333333,False
184,47613668,Show HN: Abject: the first self-aware object runtime,worldnews,10,3,mempko,2026-04-05 15:53:42.310139,0.2727272727272727,False
185,47633150,The Subprime AI Crisis Is Here,technology,51,24,dmitrygr,2026-04-05 15:53:44.809082,0.46153846153846156,False
186,47637013,MIT study challenges AI job apocalypse narrative,technology,5,2,TMWNN,2026-04-05 15:53:47.508549,0.3333333333333333,False
187,47621557,Show HN: SkiFlee (an HTML5 game),sports,8,9,BSTRhino,2026-04-05 15:53:50.065296,1.0,False
188,47591834,Do LLMs Break the Sapir-Whorf Hypothesis?,technology,15,7,dot_treo,2026-04-05 15:53:57.090857,0.4375,False
189,47633517,Lightweight IDE to Pair with Claude Code?,technology,5,2,zupancik,2026-04-05 15:53:59.664432,0.3333333333333333,False
190,47618322,Mistral secures $830M in debt financing to fund AI data center,technology,33,3,gmays,2026-04-05 15:54:02.114108,0.08823529411764706,False
191,47608080,Show HN: 65k AI voters predict UK local elections with 75% accuracy,technology,9,9,JasonDuke,2026-04-05 15:54:13.106032,0.9,False
192,47609725,Show HN: NASA Artemis II Mission Timeline Tracker,science,93,17,AustinDev,2026-04-05 15:54:17.037507,0.18085106382978725,False
193,47611572,Show HN: SideX – VS Code rebuilt on Tauri instead of Electron (96% smaller),technology,12,2,KendallCBooker,2026-04-05 15:54:19.764864,0.15384615384615385,False
194,47607159,"AbodeLLM – An offline AI assistant for Android devices, based on open models",technology,7,0,shaicoleman,2026-04-05 15:54:22.326844,0.0,False
195,47619319,Show HN: RiceVM – A Dis virtual machine and Limbo compiler in Rust,entertainment,6,0,habedi0,2026-04-05 15:54:32.283782,0.0,False
196,47639757,Hims and Hers warns of data breach after Zendesk support ticket breach,technology,8,0,Brajeshwar,2026-04-05 15:54:35.910096,0.0,False
197,47592113,"Jami – free/libre, end-to-end encrypted, and private communication software",technology,44,4,smartmic,2026-04-05 15:54:38.346569,0.08888888888888889,False
198,47634073,CBP Facility Codes Sure Seem to Have Leaked via Online Flashcards,technology,12,1,couchand,2026-04-05 15:54:40.765204,0.07692307692307693,False
199,47624164,AI models will deceive you to save their own kind,technology,14,1,cmsefton,2026-04-05 15:54:43.270709,0.06666666666666667,False
200,47617630,"Show HN: Mac-hardware toys, control your Mac's hardware like a modular synth",worldnews,7,1,nikisweeting,2026-04-05 15:54:47.212726,0.125,False
201,47593620,1-Bit Bonsai: The First Commercially Viable 1-Bit LLMs,technology,9,1,wmf,2026-04-05 15:54:57.031989,0.1,False
202,47616185,Show HN: AI-first PostgreSQL client for Mac,technology,5,0,Guillim,2026-04-05 15:55:01.055255,0.0,False
203,47606909,Cindy Cohn of the EFF Interviewed by Jon Stewart on the Daily Show [video],technology,36,1,latexr,2026-04-05 15:55:10.986265,0.02702702702702703,False
204,47590281,Claude Code leaked features and hidden commands,technology,11,1,ishqdehlvi,2026-04-05 15:55:17.009792,0.08333333333333333,False
205,47620867,Proton Workspace: An encrypted suite for team collaboration,sports,26,4,teekert,2026-04-05 15:55:23.970258,0.14814814814814814,False
206,47613181,Show HN: I run a full software company solo with Claude Code agents,technology,6,0,martinovigiani,2026-04-05 15:55:26.360723,0.0,False
